media_name,publish_date,title,url,body
nypost.com,1/6/2020,Marianne Williamson for the angels and other commentary,https://nypost.com/2020/01/06/marianne-williamson-for-the-angels-and-other-commentary/,"Iconoclast: Marianne for the Angels Once upon a time, The Week’s Matthew Walther “knew” how the 2020 election would end: “Dark Lord” Donald Trump would face off against Marianne Williamson, who would “vanquish him with the power of love before flying away on a cloud.” So much for the fantasy: With the layoff of Williamson’s campaign staff, her presidential bid is “effectively over.” While mainstream journalists “ignored or mocked” her belief in “the fundamentally spiritual nature of our political crisis,” though, their “grotesque jeering” was “the ­ultimate vindication of her position.” Williamson didn’t attack specific policies; her opponents were “cruelty, avarice, crassness, irreligion and indifferentism” — the reasons “our society will remain sick.” That’s why she “always makes such a fuss about angels”: It’s the heavenly host “on whose side she is ultimately fighting.” Foreign desk: Iran’s the One in the Corner “For all the current furor over the death of Qassem Soleimani, it is Iran, not the US and the Trump administration, that is in a dilemma,” argues National Review’s Victor Davis Hanson . While Tehran wants to “lure us into situations” in which we seem the aggressor, the regime “deeply erred” in underestimating President Trump. Unlike President Barack ­Obama, whose foreign-policy “naïveté” was “so lucrative and advantageous to Iran prior to 2017,” Trump realizes he can “respond to Iranian tit-for-tat” without going to war or losing credibility — all without alienating his base, which is “nationalist-populist and Jacksonian, not merely doctrinaire isolationist.” And, as “complex and dangerous” as this crisis is, “so far the Iranians, not the US, are making all the blunders.” From the left: Democrats’ Strategic Conundrum It’s “strategy,” not “ideology,” that’s dividing Democrats, argues Bill Schneider at The Hill — specifically: “Should the party be a coalition or a movement?” While a coalition “brings together voters with diverse interests who agree on one thing,” movement supporters are “expected to agree on everything.” All Democrats need to do now is “hold the anti-Trump coalition together” to win over “voters of all persuasions who object to Trump’s governing,” yet the Democratic campaign so far, with its “focus on issues like a wealth tax and a Green New Deal,” sounds “esoteric and irrelevant” to many voters. The party’s best hope remains Joe Biden, who wants to “find common ground” with Republicans and independents. That’s “how a coalition is built” — and how Democrats could win in November. 2020 watch: The Bizarro Primary Democrats are “now beginning to confront” an unsettling but “very real” scenario, reports Politico’s David Siders : It may not be “states where campaigns have been plowing ground for more than a year” that decide the nomination — but, instead, “places and calendar dates so deep into primary season that until recently they’ve received almost no attention at all.” One Dem strategist cites the growing likelihood that “we get past Super Tuesday and there’s still five people in the field,” giving post-Super Tuesday states new prominence. Another complication: Michael Bloomberg’s “apparent willingness to spend limitless sums,” says Siders, allows him to “overwhelm” opponents’ “early operations across the Super Tuesday map” — while “the imperative to spend heavily in early states” is spreading other candidates thin. Plus, “early voting practices are creating a dynamic that, in some states, is supplanting election day with an election month.” It’s all left “the campaigns — and party officials — scrambling to make sense of the reconfigured landscape.” From the right: Winning Bigly at the Border Last week, 18 illegal immigrants hoped to “exploit a loophole in US asylum policy to stay in the country” — but border agents sent them back, notes ­Issues and Insights’ John Merline . Thank President Trump’s “Migrant Protection Protocols” policy: Where illegal immigrants who claimed asylum used to “effectively get a free pass,” now they must “wait in Mexico while immigration judges review their cases.” The policy and others like it have created a “virtual border wall.” A real wall is still imperative, though: A future president could reverse Trump’s immigration policies, but “wouldn’t dare tear down a wall that’s already been built.” — Compiled by Karl Salzmann"
nypost.com,1/15/2020,Democratic debate: Post-debate fireworks highlight of otherwise ho-hum night,https://nypost.com/2020/01/15/democratic-debate-post-debate-fireworks-highlight-of-otherwise-ho-hum-night/,"On a night none of the six Democrats on stage in Iowa did anything to break away from the pack, the most interesting moment came after the debate — when Elizabeth Warren pulled back from Bernie Sanders’ attempted handshake. The two longtime friends, their party’s progressive standard-bearers in the presidential race, have been at odds since Monday over a 2018 conversation during which she claims Sanders told her that a woman couldn’t win the general election. They disagreed over the issue again during Tuesday night’s debate . Afterward, Warren greeted former Vice President Joe Biden warmly, shaking his hand and patting him on the arm. She then approached Sanders, and he extended his hand — only to see her pull hers back and clench it into a fist. What did they say!!!!!! pic.twitter.com/4hBhUJNB3r — Karol Markowicz (@karol) January 15, 2020 They then exchanged words — and it was clear neither was smiling. Earlier, the matter made for a rare notable moment during a debate that left undecided voters in next month’s crucial Iowa Democratic caucus knowing they’ll have to keep looking “I didn’t say it,” insisted Sanders, of Vermont. “Anybody [who] knows me knows that it’s incomprehensible that I would think that a woman cannot be president of the United States.” Warren offered a different recollection of their December 2018 closed-door meeting. She insisted that a woman could defeat President Trump in November — and she came prepared with stats to prove it. “I disagreed,” the Massachusetts lawmaker said, affirming that Sanders did, in fact, make the remark. “But look, this question about whether or not a woman can be president has been raised, and it’s time for us to attack it head on. “Look at the men on this stage: Collectively they have lost 10 elections,” she continued, referring to Sanders, former South Bend, Ind., Mayor Pete Buttigieg and Biden. “The only people on this stage who have won every single election that they’ve been in are the women.” The argument drew one of the night’s few vocal reactions from the crowd at Drake University in Des Moines — and kudos from Minnesota Sen. Amy Klobuchar, the other woman onstage Tuesday night who shared Warren’s unbeaten record. “I hear that. People have said it [to me],” said Klobuchar, referring to remarks like the one Sanders purportedly made. “I point out that you don’t have to be tallest person in the world — James Madison [who was the nation’s fourth president] was 5-foot-4. “You don’t have to be the skinniest person in the room. You don’t have to be the loudest person,” Klobuchar continued. “You have to be competent.” The team-up with Warren was one of few standout moments for Klobuchar, who in last month’s debate made moves to scramble up the polls, including by tangling with Buttigieg on his lack of experience on the national stage. Buttigieg had a relatively anonymous debate night, neither drawing as much flak from the field as he did in December, nor swinging for the fences with the Iowa caucus coming up on Feb. 3. Explore More Republicans bet that Dems’ toxic brand could keep them in the running for the 2026 midterms Don’t trust the mullahs, Mamdani’s ignorant ‘equity’ plan and other commentary Megyn Kelly says she’d remain a loyal GOP voter even if Trump dropped ‘a nuke’ on another country That was somewhat surprising for the former mayor, the lone military veteran on stage, during the debate’s first quarter, which was dominated by foreign policy. The debate was the first held since already-high tensions between the United States and Iran was ratcheted up further by the US drone attack that killed Iranian Lt. Gen. Qassem Soleimani and the retaliatory missile strike by Iran on two Iraqi airbases quartering American troops. Warren broke from her onstage competitors by calling for a total withdrawal of US combat troops from the Middle East. “We’ve turned the corner so many times, we’re going in circles in these regions,” she said of repeatedly dashed assurances that a US military victory was near. On the prospect of a summit with North Korean despot Kim Jong-un, Biden said that “absent preconditions, I would not meet with the, quote, supreme leader who said Joe Biden is a ‘rabid dog’ who should be beaten with a stick,” referring to a remark circulated by the Hermit Kingdom’s state-run media. “Other than that, you like him?” cracked Sanders, in a fleeting moment of crowd-pleasing levity. If Biden, Warren, Sanders, Buttigieg and Klobuchar didn’t break away from the pack, they at least played the hits. The same could not be said for the night’s sixth candidate, ­billionaire hedge-funder Tom Steyer, whose political inexperience continued to leave him doe-eyed and tongue-tied amid the field of heavyweights."
nypost.com,1/20/2020,House Dems file response to Trump's impeachment defense,https://nypost.com/2020/01/20/house-dems-file-response-to-trumps-impeachment-defense/,"Explore More Iranian-American Dem pushes wild plot to impeach Pete Hegseth and push cabinet to remove Trump —  in the middle of Iran war Newsom’s $19 million ad buy: impeachable, by his own definition Sen. John Cornyn claims Texas AG Ken Paxton’s ‘vanity project’ will doom GOP in midterms, lead to Trump impeachment House Democrats on Monday filed a scathing response to President Trump’s defense memorandum, rejecting his assertion that he had done nothing wrong and that the articles of impeachment passed against him were bogus. The document, filed with the Senate a day ahead of impeachment proceedings, charges that Trump despite his denials did pressure Ukraine to announce probes into Joe Biden and his son Hunter that could help him politically. “He used presidential powers to pressure a vulnerable foreign partner to interfere in our elections for his own benefit. In doing so, he jeopardized our national security and our democratic self-governance,” read the filing, signed by the seven House impeachment managers , including New York Reps. Jerrold Nadler and Hakeem Jeffries. Trump, they continued, then obstructed Congress by refusing to cooperate with the House investigation. “He then used his Presidential powers to orchestrate a cover-up unprecedented in the history of our Republic: a complete and relentless blockade of the House’s constitutional power to investigate high Crimes and Misdemeanors,” the document continued, calling the president ”the Framers’ worst nightmare come to life.” The lawmakers also rejected the president’s claim that his executive powers gave him the authority to ask for probes into the Bidens and an unsubstantiated theory that it was Ukraine and not Russia that meddled in the 2016 US presidential election. “President Trump maintains that the Senate cannot remove him even if the House proves every claim in the Articles of impeachment. That is a chilling assertion. It is also dead wrong. The Framers deliberately drafted a Constitution that allows the Senate to remove Presidents who, like President Trump, abuse their power to cheat in elections, betray our national security, and ignore checks and balances,” they wrote. The House, they added, had compiled a trove of evidence proving that Trump had acted improperly, and it was now up to the GOP-led Senate to insist on examining all of the evidence in the case, not just what was contained in the two articles of impeachment. “The Senate should require the President to turn over the documents he is hiding. It should hear from witnesses, as it has done in every impeachment trial in American history; it especially should hear from witnesses the President blocked from testifying in the House,” the Dems argued. Previous 1 of 5 Next Advertisement AP REUTERS Advertisement AP Advertisement And they disputed the president’s frequent charge that impeachment was “a hoax.” “President Trump asserts that his impeachment is a partisan ‘hoax.’ He is wrong,” they wrote. “Trump engaged in a cover-up that itself establishes his consciousness of guilt. Innocent people seek to bring the truth to light. In contrast, President Trump has acted in the way that guilty people do when they are caught and fear the facts,” they wrote. “President Trump did not engage in this corrupt conduct to uphold the Presidency or protect the right to vote. He did it to cheat in the next election and bury the evidence when he got caught.” The White House earlier Monday released a trial memorandum outlining Trump’s defense strategy. See Also Trump lawyers seek quick acquittal, call impeachment 'illegitimate from the start' Trump’s legal team argues that the president should be acquitted because the Democratic-led House overstepped its authority and committed a “brazenly political act … that must be rejected.” “The Articles of Impeachment now before the Senate are an affront to the Constitution and to our democratic institutions. The Articles themselves—and the rigged process that brought them here—are a brazenly political act by House Democrats that must be rejected,” a statement accompanying the document read. “They debase the grave power of impeachment and disdain the solemn responsibility that power entails. Anyone having the most basic respect for the sovereign will of the American people would shudder at the enormity of casting a vote to impeach a duly elected President,” the statement continued. “All that House Democrats have succeeded in proving is that the President did absolutely nothing wrong. All of this is a dangerous perversion of the Constitution that the Senate should swiftly and roundly condemn.”"
nypost.com,1/26/2020,Joe Biden's bias comes through in trying to outwoke competition: Devine,https://nypost.com/2020/01/26/joe-bidens-bias-comes-through-in-tweet-devine/,"More From Miranda Devine Miranda Devine: Tulsi Gabbard keeps her focus on revealing Deep State’s dirty secrets — even as it tries to take her down Miranda Devine: Gavin’s first partner is a ‘New’sance Miranda Devine: Dems’ callous rebuke of an Iryna Zarutska mural exposes their own twisted, backwards ‘values’ Joe Biden doesn’t sound very moderate when he says there is “no room for compromise” on “transgender equality.” It is the “civil rights issue of our time,” he tweeted last week , elevating it above women’s equality, racial equality, and even climate “justice,” an issue he once told us was an “existential threat.” The tweet was rather baffling, other than as an exercise in identity pandering. Maybe Biden thought he could win over a segment of the 0.3 percent transgender voters who are irate that Bernie Sanders accepted an endorsement from libertarian podcaster and pronoun purist Joe Rogan. But, by trying to outwoke Sanders on gender fluidity, Biden is empowering a tyrannical micro-minority determined to overturn biological reality and crush dissent. Exhibit A is Denver Post columnist Jon Caldara, fired for writing that there are “only two sexes, identified by an XX or XY chromosome.” “ ‘They’ is singular and up is down,” wrote Caldara in a Jan. 7 column criticizing The Associated Press Stylebook, the language-usage bible for reporters, which has decreed that gender is no longer binary and that “they” can be used as a singular pronoun. Two weeks later, he slammed a Colorado law which requires controversial sex-education content in schools. Democrats “don’t want education transparency when it comes to their mandate to convince your kid that there are more than two sexes, even if it’s against your wishes,” he wrote. This was the last straw for his editors. After writing a weekly column for four years, he was shown the door. Caldara is no social conservative. He supports-same sex marriage and doesn’t like Donald Trump. But, like Rogan, he is a libertarian who objects to compelled speech and “inaccurate pronouns.” So, it doesn’t matter how the Denver Post tries to spin it, his firing is an attack on free speech by the very institution entrusted to defend it. The paper has been opaque about its reasons, alluding only to “disrespectful language” in an editor’s note last week. But any fair reader of the statements of biological reality which Caldara reposted on social media would be hard pressed to find disrespect. Clearly, his editors thought his words were fine when they published them. But the Denver Post is a shadow of its former self. Under the oppressive ownership of a hedge fund, it lacks the institutional courage required to stand against the transgender bullying which attacks any expression deviating from gender fluid orthodoxy. See Also Brooklyn borough president tells new New Yorkers to 'go back to Iowa' The paper’s disintegrating backbone follows the decline of a free press all over the country, as Google and Facebook siphon away news revenue, and fake news muscles in. Alden Global Capital took control of the Denver Post in 2010 and runs it through its subsidiary, Digital First Media, which has bought up some of the biggest newspaper chains in the country, including the McClatchy and Gannett organizations. It controls dozens of newspapers, from California to Massachusetts, and has stripped them to the bone. It’s no scoop to understand that hedge funds with an appetite for extracting remnant value from failing newspapers have no interest in freedom of speech or the constitutional value of the Fourth Estate, let alone the importance of objective truth. And the last thing woke capital wants is to be targeted by transgender activists. No special interest group is more relentless in crushing dissent around the world, using character assassination as a weapon. When you have no commitment to free speech, surrender to bullies is the logical path of least resistance. This may also explain Joe Biden’s trans-virtue signaling last week, to counter suspicions about his Catholic background and past cordiality toward Mike Pence. But, if the leading moderate of the Democratic presidential field is promising to make transgender ideology his human-rights priority, we should understand what that means, for women’s sports, for schools, for prisons, for the military, for language. If there is to be no compromise on transgender rights, then the rights of women and girls will have to be sacrificed. Does Biden not care, for instance, about the right of biological females to compete in team sports on a level playing field, rather than against transgender athletes with all the natural physiological advantages that come from being born male? How about the right of girls to preserve their modesty in single-sex locker rooms? Or the right of students not to be confused in sex-ed classes by radical gender theory which disputes the biological reality of two sexes. Like every other minority, transgender people should be protected from discrimination, as our laws demand. But if you take him at his word, what Biden is advocating is the forceful restructuring of society according to the irrational demands of a subsection of a tiny minority. It’s no way to win an election. Boy’s death avoidable The twitter feed of Thomas Valva’s mother makes for sinister reading now that we know her accusations of abuse ended with the 8-year-old’s death allegedly at the hands of his cop father. New York City police Officer Michael Valva and his fiancée, Angela Pollina, have been charged with second-degree murder over the autistic boy’s death, after he was forced to sleep outside in in a freezing garage. But if anyone had listened to the boy’s Polish-born mother, he might still be alive. See Also Pundit who trashes Joe Biden once tried to work for him For two years, Justyna Zubko-Valva has been posting heartrending videos and credible evidence of harm to her three sons on twitter. She even posted letters from teachers saying the boys were starving and filthy. Why were her complaints to authorities unanswered? Something is very wrong with a child-welfare system which ignores a mother’s fears. Your excuses don’t fool anyone, Eric Brooklyn Borough President Eric Adams doesn’t fool anyone when he says his Martin Luther King Day rant about gentrification wasn’t a racial slur against white people. The crowd only started cheering when he said: “ Go back to Iowa! You go back to Ohio! New York City belongs to the people that was here and made New York City what it is.” It was a dog whistle about majority white states, and he disgraced his office when he chose to stoke division rather than promote healing at a time when New York is suffering from a plague of anti-Semitic attacks. Some perpetrators have tried to justify their hate crimes using the same excuse, that they are being alienated from old neighborhoods. I tried to give Adams a chance last week to explain, but he dodged requests for an interview. “I never once mentioned race,” he finally said in an e-mail through a spokesman yesterday. “Cleveland, Ohio, for example, is majority-black. I have always felt gentrification is not about race, but attitude.” Unconvincing from a wannabe mayor of this melting pot."
