media_name,publish_date,title,url,body
nypost.com,9/6/2020,Antifa riots may be part of Democrat power grab: Devine,https://nypost.com/2020/09/06/antifa-riots-could-be-part-of-democrat-power-grab-devine/?utm_source=facebook_sitebuttons&utm_medium=site+buttons&utm_campaign=site+buttons,"More From Miranda Devine Miranda Devine: Tulsi Gabbard keeps her focus on revealing Deep State’s dirty secrets — even as it tries to take her down Miranda Devine: Gavin’s first partner is a ‘New’sance Miranda Devine: Dems’ callous rebuke of an Iryna Zarutska mural exposes their own twisted, backwards ‘values’ Imagine you were at a restaurant and BLM-Antifa protesters descended on you, threw your food on the ground, broke plates, overturned chairs, tossed a potted plant into your oyster platter and forced you to leave. That’s what happened in upstate Rochester Friday night at the Ox and Stone, and across the road at Swan Dive, when hundreds of protesters chanting “Black lives matter” chased off frightened diners. “We’re shutting your party down,” a woman shouts in footage aired by FreedomNews TV. The oyster-platter incident reportedly occurred at Korean steakhouse Cote in the Flatiron District . Protesters brandishing a “Death to America” anarchist banner and chanting “Every city, every town, burn the precinct to the ground” left a trail of destruction in the city Friday night. One of those arrested for felony rioting was wealthy Upper East Side college student Clara Kraebber , 20, a member of the Young Democrats. Whether or not all rioters are Democratic voters, they increasingly are associated with Joe Biden’s campaign in the minds of voters who fear violence is coming to their suburb. This rolling campaign of anti-police street violence is killing Biden’s bid for the presidency — just look at private polling in crucial swing states such as Michigan, Wisconsin and Pennsylvania, where law and order has become a decisive issue. So why don’t Democratic leaders do more to condemn the violence and call for calm? To understand their inaction, you need to step back and see street violence as one element of a coordinated “playbook” to dislodge President Trump, regardless of the outcome of the election. This is the thesis of political theorist Dr. Darren Beattie, a former Duke University professor and White House official. The playbook is straight from the strategies the US government has deployed in so-called “Color Revolutions” in Eastern European countries, such as Ukraine or Belarus, to remove “authoritarian” leaders deemed hostile to American interests. In a series of articles at Revolver.news, Beattie’s thesis provides a compelling comparison between Deep State efforts to remove President Trump and techniques used by the State Department, covert agencies and allied NGOs to influence, or overturn, elections in foreign countries. BLM-Antifa’s “mostly peaceful protests” are America’s version of Ukraine’s Orange Revolution, where civil unrest was fomented on the streets to oust a Kremlin-backed authoritarian. In an interview, Beattie noted “strong parallels” between “color revolutions” overseas and the “sustained coordinated coup against Trump” — from the Russia collusion hoax to his impeachment over Ukraine. “The very same regime change professionals … assigned to overthrow ‘authoritarians’ in Eastern Europe are the ones running this operation against Trump. It is the same playbook run by the same people.” The Color Revolution playbook starts by creating the narrative of an authoritarian, illegitimate leader. Then you foment unrest on the streets, aimed at provoking an authoritarian crackdown that can be used to mobilize further unrest. You undermine people’s faith in the election process, setting up a contested outcome that turns into street fighting. At the same time, you wage relentless “lawfare” to contest ballots. Ultimately the military may be called upon to dislodge the incumbent. An added twist for America is that Democrats have used the pandemic to institute mass, unsolicited mail-in ballots, which historically are open to fraud and coercion, an experiment which will leave the election result undecided on Nov. 3. It would be easy to dismiss Beattie’s idea as a wild conspiracy theory, except anti-Trump forces are doing their best to play along. Take the Transition Integrity Project, a bipartisan war-gaming exercise created by academics, former Clinton and Obama operatives, never-Trumper Republicans, journalists and diplomats, “out of concern that the Trump administration may seek to manipulate, ignore, undermine or disrupt the 2020 presidential election and transition process.” Project co-founder Rosa Brooks, former special counsel at the George Soros-linked Open Society Foundations in New York, laid out four scenarios for the election: a big Biden win; a narrow Biden win; a period of extended uncertainty as in 2000; and a Trump Electoral College win but popular vote loss, as in 2016. See Also Democrats determined to treat November's election as illegitimate — unless they win Only with the scenario in which Biden wins an overwhelming victory is there a “relatively orderly transfer of power,” Brooks wrote last week in the Washington Post. “Every other scenario we looked at involved street-level violence and political crisis … massive disinformation campaigns, violence in the streets and a constitutional impasse.” Straight out of the Color Revolution playbook. The aim is to lay the groundwork to reject the election results if Trump wins, with the expectation that he will not concede defeat and will have to be dislodged by military means. Again, this sounds insane, I know. But this is the scenario posed by two retired Army officers, John Nagl and Paul Yingling, in a respectable military publication, Defense One, last month. In an open letter to Joint Chiefs of Staff Chairman Gen. Mark Milley, they suggested the 82nd Airborne could be used to remove Trump “by force” from the White House in January. Hillary Clinton echoed the sentiment : “Biden should not concede under any circumstances.” Biden has said he is “absolutely convinced” the military would “escort” Trump from the White House if he refused to leave office. The narrative grew so persistent that Milley felt compelled to issue a letter to Congress declaring the military will not help settle disputes if the election results are contested. Attorney General Bill Barr warned on CNN last week that the Democrats’ push for unsolicited mail-in ballots is “playing with fire” in our divided country. To put it mildly. But, apart from complaining, what is the government going to do about it? In defense of Assange Julian Assange’s extradition hearing in London starts this week as he fights espionage charges in the United States. But if Trump is considering pardoning Edward Snowden , as he suggests, the case is even stronger to go easy on the WikiLeaks founder. Snowden was an intelligence contractor who leaked information showing the National Security Agency was spying on US citizens during the Bush and Obama administrations. The leak was in the public interest, but Snowden betrayed his employer. Assange, on the other hand, merely published the information he received from jailed former US Army intelligence analyst Chelsea Manning. It was the same when WikiLeaks published the DNC ­emails that caused such a stir in the 2016 campaign. Dems insisted the Russians hacked the emails, while others suggested it was an inside leak. “Julian has always maintained that the source of the DNC emails was not a state actor,” Assange’s mother, Christine, told me Saturday. Given what we have learned during Russiagate about the compromised state of our intelligence agencies, Assange deserves a medal rather than jail. That’s relief?! It has killed 24,000 New Yorkers, thrown hundreds of thousands out of work and plunged the city into despair. But Chirlane McCray was relieved when the pandemic erupted because she got a break from her arduous duties as the city’s first lady. No kidding. “I think I went from relief from not having to do the regular schedule because you know a lot of what I do, my husband does, we do events,” she said Friday at a virtual event. How selfish do you have to be to think like that, and how tactless to admit it? Hey, Chirlane, take a load off. The city would be better off if you and your gormless husband took a permanent break."
nypost.com,9/23/2020,Liberal media's pass on sloppy Joe and scandalous Hunter Biden: Devine,https://nypost.com/2020/09/23/liberal-medias-pass-on-sloppy-joe-and-hunter-biden-devine/?utm_campaign=iphone_nyp&utm_source=facebook_app,"More From Miranda Devine Miranda Devine: Tulsi Gabbard keeps her focus on revealing Deep State’s dirty secrets — even as it tries to take her down Miranda Devine: Gavin’s first partner is a ‘New’sance Miranda Devine: Dems’ callous rebuke of an Iryna Zarutska mural exposes their own twisted, backwards ‘values’ The witness protection of Joe Biden by the media is starting to look like election interference. Exhibit A: The Senate interim report released Wednesday detailing millions of dollars Joe Biden’s son Hunter received from corrupt foreign oligarchs and companies while his father was vice president. Despite its obvious news value, the report immediately was pilloried by influential media outlets such as The New York Times and The Washington Post as “inconclusive” partisan echoing of Russian propaganda. “Republican Inquiry Finds No ­Evidence of Wrongdoing by Biden,” was the Times’ headline. “GOP’s Hunter Biden report doesn’t back up Trump’s actual conspiracy theory — or anything close to it,” said The Washington Post. “GOP senators’ anti-Biden report repackages old claims” was another typical headline dismissing the ­report, this from Politico. Yet there are new and damning allegations in the report about Hunter’s ability to leverage his father’s position as vice president into riches for himself and his friends. The old allegations were damning enough, anyway, despite the fact they have been flushed down the memory hole. Take Hunter’s $50,000 monthly payment for sitting on the board of Ukrainian natural-gas firm Burisma Holdings , despite no relevant experience and a history of drug problems , at a time when his father was in charge of US policy toward Ukraine. But here’s just one of the new revelations: Hunter received a $3.5 million wire transfer in 2014 from Elena Baturina, the wife of the former mayor of Moscow, and a billionaire friend of Vladimir Putin. Now that’s real Russian collusion. Given the gravity of the allegations, you would think that the ­media pack following Joe Biden would have asked him a question yesterday about the report. Hunter Biden DNC via USA TODAY NETWORK/Sipa USA But reporters didn’t even though Biden took questions on three occasions during a visit to North Carolina, the most available he has been to the press since he retreated to his basement in March. At 10 a.m. at the Wilmington airport in Delaware, Biden answered three questions: how he was preparing for next week’s debate; whether US relations with China will be a “zero-sum game” if he is elected; and was he “still vetting potential Supreme Court nominees?” On the tarmac in Charlotte, NC, he was asked, “What gives you the sense that you can win?” Seriously. Talk about softballs. There were more questions at about 1:30 p.m., after he delivered a teleprompter speech: What would he like to see for Historically Black Colleges and Universities? What is he going do about the minimum wage? What are his plans for “educational equity”? Will small businesses get COVID relief? How do you reimagine the Justice Department and its Civil Rights division after four years of Trump? Finally, at Charlotte on the way home at about 6:30 p.m., Biden fielded more questions, about the Breonna Taylor ruling, Iran and what he thought about Supreme Court contender Amy Coney Barrett. Nothing all day on Hunter Biden. Here are some more allegations from the interim report, “Hunter Biden, Burisma, and Corruption: The Impact on US Government Policy and Related Concerns,” authored by Senate Homeland Security Committee Chairman Ron Johnson (R-Wis.), and Senate Finance Committee Chairman Chuck Grassley (R-Iowa): Hunter and his family were involved in a vast financial network that connected them to foreign nationals and foreign governments across the globe. Hunter had business associations with Ye Jianming, Gongwen Dong and other Chinese nationals linked to the Communist government and the People’s Liberation Army. Those associations resulted in millions of dollars in cash flow. Hunter opened a bank account with Gongwen Dong to fund a $100,000 global spending spree with uncle James Biden and aunt Sara Biden. Hunter paid women who were nationals of Russia or other Eastern European countries who appear to be linked to an “Eastern European prostitution or human trafficking ring .” You can read it for yourself. But none of it was of interest to a media that spent almost four years reporting every false, unsubstantiated, salacious and ultimately discredited rumor that President Trump colluded with Russia to win in 2016. The lack of curiosity about a documented scandal on the eve of the presidential election involving one of the candidates is staggering. Conservatives show respect When conservative Supreme Court Justice Antonin Scalia died in 2016, the venom spewed by the left was gleeful and instantaneous. “Scalia was a monster and no one’s job entitles them to respect,” was a typical social media burn. Former Democratic Senate candidate and Ohio Gov. Ted Strickland joked that it “happened at a good time.” How different was the respectful reaction from conservatives to the death of Justice Ruth Bader Ginsburg? As she lies in repose, let us celebrate her remarkable life, but also be honest about the causes she championed, which were anathema to conservatives. They included: taxpayer funding of abortion, partial-birth abortion, transgender bathrooms, prostitution, coed prisons, lowering the age of consent from 16 to 12 and replacing Mother’s Day and Father’s Day with “Parent’s Day.” As corrosive as those progressive causes are, conservatives remain generous to the woman who wanted to give them the force of law. Only one side demonizes those who don’t share their values. A royal nuisance It’s fine if Prince Harry and Meghan Markle want to regurgitate Democratic talking points in a political video to boost Joe Biden’s lackluster campaign. It’s a free country, even if Harry is ineligible to vote here. Americans are used to foreigners weighing in on domestic politics. However, the queen’s grandson and his pushy American wife need to be cut loose before their woke activism becomes a contagion throughout the House of Windsor. See Also Hunter Biden got $3.5M wire transfer from Russian billionaire, report reveals The key to the British monarchy’s enduring popularity is impartiality. The Sussexes thumb their nose at the concept. They might claim they didn’t favor any one candidate in their Time 100 video, but Meghan doesn’t hide her antipathy for the president she once labeled a misogynist, and for his part, President Trump on Wednesday declared: “I’m not a fan of hers.” It’s not hard to read between the lines when Harry says: “As we approach this November, it’s vital that we reject hate speech, misinformation and online negativity.” They are making millions off a royal tradition they don’t respect. Let them campaign as commoners, just another pair of Hollywood B-listers. Anti-blue boo-hoo It’s amazing how often BLM-Defund-the-Police sympathizers call the cops when they’re in trouble. It happened on Saturday in The Bronx, when a group of angry Italian-Americans confronted protesters agitating to remove the Christopher Columbus statue in D’Auria-Murphy Triangle Park. Judging by the hot tempers and blue language, the statue foes would have been toast if the NYPD hadn’t swooped in."
nypost.com,10/7/2020,How Mike Pence intends to hit Kamala Harris in tonight's veep debate,https://nypost.com/2020/10/07/how-pence-intends-to-hit-harris-in-tonights-veep-debate/,"Explore More Biden lied about Hunter laptop at last debate with Trump, ‘Spies Who Lie’ tell Congress The wildest moments from Trump and Biden’s 2020 presidential debates America is stuck with the Biden-Trump rematch it abhors — this time let’s have a real debate Vice President Mike Pence intends to describe Democratic rival Sen. Kamala Harris as hypocritical and inconsistent during the vice presidential debate Wednesday, aides told reporters. Pence deputies specifically mentioned Harris’ prior attacks on Democratic presidential nominee Joe Biden’s record on race relations and her record prosecuting low-level drug crimes. “I think we’ll also highlight some of Senator Harris’ discrepancies in her record where she’s proven to be hypocritical,” Pence chief of staff Marc Short said on a conference call previewing the debate. “I think that’s an important part of it that thus far has not come out as much, but I think that her record is riddled with hypocrisy. And hopefully we’ll have a chance to highlight that.” Trump-Pence campaign senior adviser Jason Miller noted Harris’ 2019 attacks on Biden including over interracial school busing. “We all remember back to the primary where Kamala Harris went pretty hardcore after Joe Biden, calling out his policies, describing his policies as racist,” Miller said. “I think that Kamala Harris is gonna have to explain, quite frankly, a lot of that tonight on the national stage. How can Joe Biden’s policies be racist in the primary, but then not so in the general election? I think this will be a key thing.” Miller added later: “A lot of Kamala Harris’ prosecutor and AG record will will be on full display tonight. And one of the things that will be found in looking through it is that she was overly aggressive in prosecuting small minor offenses that disproportionately impacted black men, in particular, but also then was soft when it came to more capital cases.” Pence prepared for the debate for between six and eight weeks, Short said, including with former Gov. Scott Walker (R-Wis.) playing Harris in debate mock-ups. See Also Kamala Harris raises $2M in 24 hours with help of 'That little girl was me' shirts But the aides set expectations high for Harris, a former San Francisco district attorney and California attorney general who’s experienced at grilling opponents. “We know that Sen. Harris is a prosecutor and even though her campaign flailed, the reality is that she was a strong debater,” Short said. Walker told reporters that “Sen. Harris, having been a prosecutor, is going to be a worthy debater.” Pence will defend his performance leading the Trump administration’s COVID-19 pandemic response, the aides said, and will highlight pre-pandemic economic successes. Walker said that despite knocking Harris as inconsistent, Pence will point out Harris’ voting record, which he said was “even further to the left than Bernie Sanders and Elizabeth Warren.” “You’re going to hear a lot about recovery, about what this administration did to get us to a 50-year low when it came to unemployment before the pandemic — and what we’ve done since, particularly the more than 10.5 million new jobs created just in the last four months alone,” Walker said."
nypost.com,9/23/2020,Biden: Trump replacing Ginsburg is a 'gigantic mistake and abuse of power',https://nypost.com/2020/09/23/biden-trump-replacing-ginsburg-gigantic-mistake-abuse-of-power/?utm_source=facebook_sitebuttons&utm_medium=site+buttons&utm_campaign=site+buttons,"Explore More Supreme Court Justice Sonia Sotomayor claims colleague Brett Kavanaugh’s prep school upbringing sways his stance on ICE raids Best of the Babylon Bee: Kristi Noem asks husband if he needs to get anything off his chest Birthright citizenship’s threat, NATO’s diminishing value to US and other commentary Democratic presidential candidate Joe Biden said Wednesday it’s “a gigantic mistake” for President Trump to replace liberal icon Ruth Bader Ginsburg on the Supreme Court. “We should go to the American people and make the case why this is a gigantic mistake and abuse of power,” the former vice president told reporters as he traveled to a campaign event in North Carolina. Biden declined to say if he’s reviewing candidates to replace Ginsburg in the unlikely event a Trump nominee is blocked by the Republican-held Senate. “Look, what we should be doing now — the Democrats should be going to the American people now, their voices are about to be heard and it’s important that they make it clear what’s going to happen,” Biden said. “The Republicans, if they vote for these nominees, what’s going to happen is women’s rights as it relates to everything from medical health care is going to be gone. You’re going to find that the Affordable Care Act — we should be out there campaigning on what’s going to happen. Women will be able to be charged more than men for same procedures again. Pregnancy will be a pre-condition.” Biden has said little on the nomination battle as Trump prepares to name his conservative selection on Saturday, likely tilting the ideological balance on the court. He did not mention the issue during his subsequent remarks in North Carolina. The Democratic candidate also told reporters he’s about to begin debate preparations ahead of the first presidential forum with Trump next week. “I’ve started to prepare but I haven’t gotten into it really heavily. I will be beginning tomorrow,” Biden said. Trump said Tuesday he’s announcing a conservative replacement for Ginsburg, who died Friday at age 87, at 5 p.m. Saturday. Senate Majority Leader Mitch McConnell (R-Ky.) vowed to swiftly hold hearings and a vote for the nominee before the Nov. 3 election. Sen. Mitt Romney (R-Utah) said Tuesday he supports holding a vote on Trump’s pick — all but ensuring their confirmation. Trump said this week he’s considering five women to replace Ginsburg, including federal appeals court Judges Amy Coney Barrett, 48, and Barbara Lagoa, 52. Trump met with Barrett, a judge on the Chicago-based US Court of Appeals for the Seventh Circuit, on Monday at the White House and said afterward he may meet with Lagoa during a trip to Miami on Friday. Lagoa is a judge on the Atlanta-based 11th Circuit. Barrett was considered in 2018 for the nomination given to Brett Kavanaugh and already faces criticism from Democrats for her Catholic faith. She is well-known to DC Republicans and considered likely to cement an ideological shift on the court. Lagoa is a Cuban American favorite among Florida Republicans who argue her selection could rally Latinos behind the president ahead of the election."
nypost.com,10/7/2020,Who won the VP debate? Experts grade Kamala Harris vs. Mike Pence,https://nypost.com/2020/10/07/who-won-the-vp-debate-experts-grade-harris-pence-matchup/,
