media_name,publish_date,title,url,body
nypost.com,6/17/2020,Bolton book claims Trump pressed China's leader to aid reelection: reports,https://nypost.com/2020/06/17/bolton-book-claims-trump-pressed-chinas-leader-to-aid-reelection-reports/,"Follow the Story Trump’s ‘Donroe Doctrine’ ends America’s decline Joe Biden — and fellow Democrats — acted way more like a ‘king’ than Donald Trump Why John Bolton probably WON’T pay big if found guilty in his documents case John Bolton spotted still using White House bag tag as he surrenders in classified documents case John Bolton pleads not guilty to mishandling classified information Ex-Trump national security adviser John Bolton indicted on charges of mishandling classified information See All 235 Stories Former National Security Adviser John Bolton claims in his upcoming memoir that President Trump asked China’s Xi Jinping to help his reelection prospects by purchasing more American farm products, according to reports Wednesday. During the June 2019 G-20 Summit in Osaka, Japan, Bolton wrote, Xi noted that certain unidentified US politicians were calling for a new cold war with China, to which Trump “said approvingly that there was great hostility to China among the Democrats,” according to multiple media outlets that obtained advance copies of the book. “Trump then, stunningly, turned the conversation to the coming U.S. presidential election, alluding to China’s economic capability and pleading with Xi to ensure he’d win,” Bolton wrote. “He stressed the importance of farmers and increased Chinese purchases of soybeans and wheat in the electoral outcome.” In “The Room Where It Happened: A White House Memoir,” Bolton also says say he notified Attorney General William Barr and White House Counsel Pat Cipollone about several instances when Trump allegedly expressed a willingness to block probes of such firms as the Chinese telecom company ZTE and Turkey’s state-owned Halkbank. “The pattern looked like obstruction of justice as a way of life, which we couldn’t accept,” Bolton wrote. If Democrats had expanded their impeachment case beyond allegations surrounding the withholding of about $400 million in military aid to Ukraine, Bolton wrote, “there might have been a greater chance to persuade others that ‘high crimes and misdemeanors’ had been perpetrated.” Bolton also claims that Trump privately admitted to the “quid pro quo” at the heart of the case during a conversation in August. “He said he wasn’t in favor of sending them anything until all Russia-investigation material related to [Hillary] Clinton and [former Vice President Joe] Biden had been turned over.” The Justice Department sued Tuesday to block publication of the book, set to be released the following Tuesday by Simon & Schuster, on grounds that it contains classified information. White House counselor Kellyanne Conway warned Wednesday that national security was at risk if Bolton’s tell-all gets published before “the review processes have been completed, and press secretary Kayleigh McEnany said the book was “full of classified information, which is inexcusable.” The White House didn’t immediately comment on the reports about the book’s contents, but US Trade Representative Robert Lighthizer denied Bolton’s account of Trump asking Xi to buy soybeans and wheat so he could win re-election. “Absolutely untrue. Never happened. I was there. I have no recollection of that ever happening. I don’t believe it’s true. I don’t believe it ever happened,” he said when asked about the allegation during a Senate hearing. Douliery Olivier/Abaca/Sipa USA “Would I recollect something as crazy as that? Of course, I would recollect it.” In the nearly 600-page book, Bolton claims he repeatedly saw Trump engage in “a pattern of fundamentally unacceptable behavior that eroded the very legitimacy of the presidency.” Meanwhile, most of Trump’s underlings served him so poorly that the commander in chief “saw conspiracies behind rocks, and remained stunningly uninformed on how to run the White House, let alone the huge federal government.” Also during the 2019 G-20 meeting, Trump and Xi discussed China’s construction of concentration camps to inter the country’s population of Uighurs, an ethnic minority, Bolton wrote. “According to our interpreter, Trump said that Xi should go ahead with building the camps, which he thought was exactly the right thing to do.” Other details from the book include Bolton’s claims that: Trump’s ignorance of foreign affairs included asking then-Chief of Staff John Kelly if Finland was part of Russia and asking a British official, “Oh, are you a nuclear power?” which Bolton says “was not intended as a joke.” Secretary of State Mike Pompeo slipped Bolton a note during Trump’s 2018 meeting with North Korean dictator Kim Jong-un that said of the president, “He’s so full of s–t,” and later said the unprecedented negotiations had “zero probability of success.” Trump pressed Pompeo to deliver an autographed copy of Elton John’s “Rocket Man” on CD to Kim during the secretary’s follow-up visit to North Korea. Trump told Bolton that former Secretary of State Rex Tillerson used obscene, sexist language to refer to then-UN Ambassador Nikki Haley, which Bolton doubted but found revealing about the president. Trump held only two intelligence briefings a week, which were a waste of time because “much of the time was spent listening to Trump, rather than Trump listening to the briefers.” Trump railed against journalists during a summer 2019 meeting in New Jersey, saying they should be jailed to reveal the sources. “These people should be executed. They are scumbags,” he said. During a May 2019 phone call, Russian President Vladimir Putin “largely persuaded Trump” to back Venezuelan leader Nicolas Maduro by comparing opposition leader Juan Guaido to Hillary Clinton, which Bolton calls a “brilliant display of Soviet style propaganda.” Trump also once referred to Venezuela as “really part of the United States” and said invading it would be “cool.” Trump told Xi that Americans wanted him to change the Constitution so he could serve more than two terms. Trump intentionally sparked outrage by writing a defense of Saudi Arabian Crown Prince Mohammed bin Salman over the murder of journalist Jamal Khashoggi amid controversy over daughter Ivanka Trump using her government e-mail for private business. “This will divert from Ivanka,” he said. The book also asserts that Trump made so many false or wrong statements that quotes attributed to him are followed by disclaimers such as “(the opposite of the truth)” and that while his snap judgments sometimes mirrored Bolton’s views, others were reckless and risky. “His thinking was like an archipelago of dots (like individual real estate deals), leaving the rest of us to discern — or create — policy,” Bolton wrote. “That had its pros and cons.”"
nypost.com,6/21/2020,The Democrats' civil war is bad for the United States: Devine,https://nypost.com/2020/06/21/the-democrats-civil-war-is-bad-for-the-united-states-devine/,"More From Miranda Devine Miranda Devine: Tulsi Gabbard keeps her focus on revealing Deep State’s dirty secrets — even as it tries to take her down Miranda Devine: Gavin’s first partner is a ‘New’sance Miranda Devine: Dems’ callous rebuke of an Iryna Zarutska mural exposes their own twisted, backwards ‘values’ The riots and mayhem on our streets in the shadow of the presidential campaign are in some ways a function of the civil war raging inside the Democratic Party between the radical left and the old guard. The radical left, represented by freshman democratic socialist Rep. Alexandria Ocasio-Cortez and her so-called “squad” of progressive congresswomen , has been staging a hostile takeover against the old guard, represented by House Speaker Nancy Pelosi. That old guard is trying to preserve its power with a strategy of appeasement that is dragging the party even further left. Whether it’s defunding police, closing jails, open borders, legalizing drugs, or the poverty-inducing Green New Deal, the democratic socialists are winning arguments inside the party. The only thing that unites the two warring factions is a mutual loathing for President Trump. But their existential psychodrama is destabilizing our political system. It may even explain why the party’s presumptive presidential nominee, Joe Biden, is someone whose frailties are so blindingly obvious you wonder how he can last until November, let alone run the country. It is unhealthy to have one of the two main parties paralyzed by internal conflict. So, it’s in all of our interests for the Democratic Party to rid itself of the cancer of its democratic socialist faction. With that in mind, Tuesday’s Democratic primary in New York’s 14th Congressional District is crucial. This is, of course, the Bronx-Queens seat won in 2018 by the leading light of the democratic socialists, AOC, who now is under challenge from the formidable former CNBC journalist, Michelle Caruso-Cabrera, a.k.a MCC. The tough-talking 53-year-old from Sunnyside has pitched herself as a reasonable, moderate centrist against AOC, 30, who she says is “not a real Democrat.” “She and other people like her have hijacked the Democratic Party . . . for her polarizing leftist policies.” MCC says her priority for the district is jobs. “Results not revolution.” The two women tore into each other at a masked-face-to-masked-face debate in the Golden Palace Catering Hall in Parchester last week, with MCC landing blow after devastating blow. “With AOC you get someone who works on her celebrity status. AOC “is not a Democrat. She is not even a democratic socialist. She is a socialist.” Michelle Caruso-Cabrera at the debate. AP Photo/Kathy Willens She excoriated AOC for being the only Democrat to vote against the “hundreds of billions of dollars for the [first iteration of the] Paycheck Protection Program, which would help people get paid and get back to work.” But her most effective attack line was that AOC led the campaign to stop Amazon establishing a headquarters in Queens, which would have brought 25,000 jobs to the area. MCC quoted a restaurant owner on Queens Boulevard who told her: “I was so excited when the Amazon announcement happened . . . I thought we were going to have a boom. I was going to hire more wait staff. I was going to hire more kitchen staff and then, poof, it went away because of AOC.” She described it as “a huge opportunity lost. Those 25,000 tech jobs mean all kinds of other jobs, dry cleaners, restaurants, parking lot attendants. Those are great jobs.” She also pointed out the loss of Amazon’s $27 billion in taxes. “Imagine if we had it right now when we’re getting over this economic crisis.” The district has been hard hit by the coronavirus pandemic, and MCC spoke of “modern-day breadlines [for] the neediest of our neighbors. “They worked in kitchens, waiting tables, washing dishes, doing nails, cleaning homes and they are desperate because of the economic crisis.” AOC’s response to the attacks was petulance, punctuated by girlish giggles. She criticized MCC for having lived in Trump Tower until moving to Queens last year, and for previously being a Republican. As for the torpedoed Amazon deal, she claimed “those jobs were not coming,” and her Green New Deal would create thousands of jobs anyway. Yeah, sure. See Also AOC defends record amid jabs from rival Caruso-Cabrera in final debate “We have to be very wary when a huge corporation comes in, refuses to unionize their work staff, refuses to negotiate with local elected officials . . . [tries] to bully our community . . . we should be investing that money in small businesses.” “There is no money,” replied MCC. AOC is divisive and disloyal to her own party. She is anti-Israel, and, where MCC rightly said China is our biggest foreign-policy issue, AOC declared her warped priorities include “standing up to the growing specter of authoritarianism worldwide, whether it’s [President Jair] Bolsonaro in Brazil, whether it’s [Prime Minister Narendra] Modi in India.” AOC also was “proud” of being behind the push to defund the NYPD, “a very simple demand” to strip $1 billion from its $6 billion budget. Of course, the people who would be worst affected by reduced policing are her own constituents. AOC has proven that she is unfit to hold public office. She is a grandstanding activist who refuses to grow up. Above all else, she deserves to lose her seat for driving away Amazon. In hindsight, post-COVID, the decision is even more heartbreaking, with those jobs desperately needed. Rally bad day for Don team The president seemed out of sorts Saturday night at his first rally since the pandemic struck . And no wonder. At his last rally, almost four months ago, he was riding a booming economy and record low unemployment rate to a near-certain election win. Now, with tens of millions of Americans out of work, he is lagging in the polls behind a rival as lackluster Joe Biden. But what could have been a triumphant comeback in Tulsa was marred by his campaign’s stupid strategy of inflating expected crowd numbers. This allowed hostile media — including the increasingly anti-Trump Drudge Report — to focus on the empty seats and portray the event as a failure. See Also Trump blasts Joe Biden, praises Tulsa 'warriors' for braving coronavirus fears at rally Considering we are still in a pandemic, it was a brave turnout in the 19,000-capacity arena which looked to be about 75 percent full. But the president had boasted beforehand that there would not be a single empty seat. His campaign even had set up an outdoor stage for the expected overflow which never materialized. They were fooled by a sabotage effort on social media to inflate the numbers, which contributed to an absurdly unrealistic 1 million ticket requests. The campaign should have known the risks and underplayed expectations. But, then again, compared to Biden’s somnolescent rival event in Pennsylvania for a socially distanced audience of 20, Trump’s comeback rally looked like a rip-roaring success. Barr ballot sense You know Attorney General Bill Barr is doing a good job by the level of vituperation against him. The push is on in earnest to impeach him now that his Department of Justice is getting close to criminal charges in the Russia collusion coup attempt against the president . He wouldn’t be drawn out on details of the investigation, in an interview Sunday with Fox Business’ Maria Bartiromo. But he did confess he is worried about the public losing confidence in the integrity of elections, “When state governments start adopting these practices like mail-in ballots that open the floodgates of potential fraud, then people’s confidence in the outcome of the election is going to be undermined and that could take us to a very dark place.” “The one thing we have going for us, especially when there’s intense division in the country, is that we have peaceful transfers of power and the way to resolve it is to have an election. No matter who wins in November, it’s in everyone’s best interest to strengthen the integrity of the voting process, instead of undermining it."
nypost.com,6/30/2020,Democrats playing politics with Black Lives and other commentary,https://nypost.com/2020/06/30/democrats-playing-politics-with-black-lives-and-other-commentary/,"DC desk: Dems Playing Politics with Black Lives “Do black lives matter to Democrats?” asks Glenn Harlan Reynolds at USA Today . “A lot of black voters think the answer is no.” A Politico reporter spent time with “middle-class black voters outside Detroit” and “found they were disappointed in the Democrats” and “thought nothing much had changed for them during the Obama presidency.” Reynolds suspects that’s why “Democrats are blocking the GOP justice-reform bill in the Senate.” They’re “terrified” President Trump “might deliver a major reform bill in Congress before the election.” He has “already successfully pushed a criminal-justice reform package, the First Step Act,” and “issued an executive order limiting police chokeholds and other abusive behavior.” Dems would rather Congress pass no reform than have black voters “see Trump as performing where the Democrats . . . never did.” Iconoclast: The Church of Social Justice The “social-justice philosophy” behind Black Lives Matter protests is “less a political program” and more “a religion in all but name,” argues John McWhorter at Reason : Adherents “display their moral worth through opposition to racism,” just as Christians “display their moral worth through faith in Jesus.” Solving America’s real race problems “will require work”; chanting “allegiance with upraised hands to a series of anti-white-privilege tenets” and washing “black protesters’ feet” are just crypto-religious “self-flagellation routines.” This new religion holds that whites should “suspend logic and have faith” in the movement and “even has (metaphorical) sacrificial victims.” That would have “sickened” genuine civil-rights heroes, who fought “injustices with sense and logic.” Liberal: Be Bold, Biden! Before Joe Biden picks his running mate, advises Juan Williams at The Hill , he should “name three Cabinet secretaries” — Elizabeth Warren for Treasury, Amy Klobuchar for attorney general and Susan Rice for secretary of state — and Kamala Harris as his “first Supreme Court nominee.” Sure, the strategy creates “new targets for Trump to belittle,” but it also tells voters Biden is “fired up, ready to govern” and will energize suburban women and left-wingers. He should stipulate that Rice, Warren and Harris remain vice-presidential contenders, with Rice in particular providing him with “a fierce tag-team partner,” even if choosing her would set off “red lights and screams” among Trump supporters. “This is no time to lay back, Joe” — so go bold. Election watch: GOP’s Cry for Help Republican senators are waging a “highly orchestrated, not remotely subtle . . . late, and desperate, campaign” to persuade President Trump to “adopt a more unifying message about how to resolve the country’s overlapping, ­excruciating crises,” writes RealClearPolitics’ A.B. Stoddard . From Chuck Grassley’s promoting a Wall Street Journal editorial that criticizes the president’s self-centered messaging to Lindsey Graham’s urging Trump to make the election “more about policy and less about your personality,” it’s a last-ditch attempt to save the president’s — and GOP senators’ — electoral chances. “Smart Republicans are watching the polls,” which show a majority of Americans “do not approve of the Trump administration’s response to the pandemic.” In light of Trump’s insistence that “I have to be myself,” though, their efforts to get Trump “to ease up on his self-destruction” are “likely doomed to fail.” Conservative: Two Cheers for Our Symbols At First Things, Gilbert Meilaender admits to having misgivings about overuse and “misuse” of the American flag and national anthem at mass events — “most especially those by well-known entertainers who seem to think that what matters is not the anthem but the performer.” Still, there is something to be said for such symbolic displays. They signify “simply that, whatever our differences on other matters both small and great, we acknowledge our shared history (both the good and the bad, in all its ambiguity), and we affirm our common bond of citizenship” — and remind us that “in defense of that shared bond some of our ancestors and contemporaries have risked their lives and in many cases given what Lincoln called ‘the last full measure of devotion.’  ” — Compiled by The Post Editorial Board"
nypost.com,7/1/2020,Mark Zuckerberg presides over a toxic world — but never really pays a price,https://nypost.com/2020/07/01/mark-zuckerberg-never-pays-the-price-for-toxic-world-he-created/,"Few unelected public figures are as smugly impervious to morals and ethics as Mark Zuckerberg. So it’s been infuriating to read all the breathless news coverage about Facebook’s latest crisis , the potential loss of $70 billion in revenue as advertisers flee the platform over its unregulated content, the company’s very survival in question. “Could a Boycott Kill Facebook?” asked the BBC. Short answer: No. “Facebook sees $60 billion in market value erased in just 2 days,” said Business Insider. So? To Zuckerberg, that’s like losing change in the couch cushions. “Facebook may be headed to the ‘graveyard of dinosaurs,’ ” said Yahoo Finance. Really? Then why has Joe Biden announced that his campaign won’t pull its advertising from Facebook, despite calls from the civil rights umbrella campaign #StopHateForProfit? “We share the concerns of companies who are speaking up about Facebook’s inaction around making meaningful changes that protect our democracy,” said a Biden spokesperson. “But with less than five months until Election Day, we cannot afford to cede these platforms to Donald Trump and his lies.” Classic verbose doublespeak for: We don’t care. We’ll do what it takes to get what we want. And it’s apt, because that’s exactly what all these major corporations ostensibly taking stands — and what Zuckerberg, in agreeing to meet with these activists — really think. Does anyone really believe that behemoths such as Coca-Cola, Starbucks, Target, Adidas and about 400 other companies are going to vanish forever from a platform that serves 2.3 billion users? Or that Zuckerberg, who has made similar feints and issued similar platitudes before, cares about anything other than power and profit? When old instant messages of Zuckerberg’s surfaced in 2010, IM’s in which he called Facebook users “dumb f—ks” for giving him so much of their private information, he told The New Yorker he had made a youthful error. “I think I’ve grown and learned a lot,” he said. Fake news, Russian bots, deep fakes on Facebook influencing the 2016 presidential election? “Pretty crazy idea,” said Zuckerberg. Used as propaganda by tyrants, despots and terrorist organizations? “Facebook has a lot of work to do,” he said in 2018. Meanwhile, social media like Facebook has been nuclear weaponized in 2020, the year in which Performative Outrage dominates. Celebrities get cancelled daily, for increasingly minor stuff. Ellen DeGeneres isn’t a nice person in real life? Kill her career! Terry Crews Richard Shotwell/Invision/AP Terry Crews, an early hero of the #MeToo movement, is on the verge of cancellation for tweeting this terrible , inflammatory sentiment: “If you are a child of God, you are my brother and sister. I have family of every race, creed and ideology. We must ensure #blacklivesmatter doesn’t morph into #blacklivesbetter.” Also: Were you aware that not posting a black square on Blackout Tuesday last month meant you were identifying as a racist? We’re renaming edible products and tearing down statues but not yet having deep, meaningful, hard conversations — conversations that invariably mean any one of us, no matter how well-meaning, might have the right thought articulated the wrong way and be cancelled for it. History is prelude, so after this civil rights summit, expect a statement about how honored and humbled Zuckerberg was to meet with these brave new leaders, how much he’s learned and will continue to learn, listen, and heed his white privilege while making Facebook a safe space for all. It’s a safe space for none. Is it any wonder that a Mark Zuckerberg thrives in this era? He was practically born for it. He created a platform under the guise of unifying us yet has actually built an ecosystem where fear, hate, disinformation, threats and vengeance is meted out daily and mercilessly — a porous space where anyone can be cancelled for anything. Except, by design, Mark Zuckerberg."
