media_name,publish_date,title,url,body
nypost.com,9/4/2020,The View' confirms Sara Haines will return to show for Season 24,https://nypost.com/2020/09/04/the-view-confirms-sara-haines-will-return-to-show-for-season-24/,"Sara Haines has been confirmed to return to ABC’s “The View” as a permanent co-host as the show returns next week for its 24th season, when a focus of the show will be on the final months of the 2020 presidential campaign. Haines was previously on “The View” from 2016 to 2018, and departed to join the network’s “GMA 3: Strahan, Sara and Keke.” After the show was canceled earlier this year, Haines has filled in from time to time following the departure of Abby Huntsman. In an interview, senior executive producer Hilary Estey McLoughlin said that Haines “is great in either place, which is rare to have somebody who is able to deal with such complex topics that we talk about on ‘The View,’ and give a perspective that is smart. She brings a lot of zest to the conversation, in addition to being very relatable at the same time.” Brian Teta, the show’s executive producer, said that Haines “brings such a thoughtful viewpoint and such warmth and energy and humor, all things that make a lot of sense to have her back at the table.” Variety first reported on Haines’ return to the show. Co-host Meghan McCain plans to go on maternity leave and will be on “The View” at the start of the season. When she goes on leave, Teta said that they will not have a replacement “but we will have a lot of good guests on the show and maybe a couple of surprise guest hosts.” He said that they want to make sure “that we have every viewpoint accounted for, including the conservative side.” As the new season starts on Tuesday, the show also is unveiling a new logo, and has lined up a number of political and news figures as guests. During premiere week they include Sarah Huckabee Sanders, the former White House press secretary; Stephanie Winston Wolkoff, the former aide to First Lady Melania Trump; Jane Fonda, John Kasich and Robin Roberts. As he gets ready to publish his tell-all, Donald Trump’s former lawyer Michael Cohen also will guest on Sept. 14. The show saw a ratings uptick in 2016, during the fall campaign of the last presidential cycle. In the fourth quarter of 2016, it drew 2.9 million total viewers, up 13% compared to the previous time frame, along with 4% to 5% growth in key demographics: 540,000 among women 25-54 and 408,000 among women 18-49. The show will continue to cover pop culture and celebrity, but politics and major national issues will be a focal point as Nov. 3 nears. “The election is our Super Bowl, so we are excited about our hosts covering this very consequential moment,” McLoughlin said. “But I think that what evolves over the season — we were at the intersection of politics, the pandemic and the racial justice movement, and we’re always reflecting the national conversation, which gives you a unique position in daytime. … The focus will continue to be that as long as that is the conversation that people are having.” Sara Haines left “The View” in 2018 to join ABC’s “GMA 3: Strahan, Sara and Keke.” Walt Disney Television Teta said, “One of the mission statements of ‘The View’ was to be a reflection of the conversations that people are having in the real world. And I think in the last couple of years, the real world is starting to look a lot more like ‘The View’ instead of the other way around. The real world has become a reflection of us, because even the arguments they are having on the show, they are having every day in families. As things become polarized, I think people are looking at our show, and seeing no matter what your viewpoint is, you see it on our show.” He said that he expects that Democratic nominee Joe Biden will be on the show in the new season, as “he has been a friend to the show over the years and has strong relationships with the hosts.” Trump has been on the show 18 times, but the last time was in 2015 via phone, and that was not long after he announced his candidacy. As president, though, he has generally avoided daytime talk and late night. McLoughlin said that they invite the president, Vice President Mike Pence and other key administration figures on the show “all the time.” “There’s definitely a place for guests in the Donald Trump camp. We’re definitely welcoming to that,” Teta said, noting that Donald Trump Jr. and Kimberly Guilfoyle were guests last year. “We definitely want to make sure that we have both sides of the aisle in the ramp-up here,” Teta said. ‘We provide valuable information, and many viewers will say they get some of their news from our show, so that is a high compliment.’ A rising star on the conservative side, Kim Klacik, running for Congress in Baltimore, will be a guest on the show’s second week of the new season. Four years ago, there was some expectation that once the election was over, there would be a drop off in the audience, but “it never really happened,” Teta said. “We kept growing. I think the culture has changed. People don’t talk about elections for [just] three months before them anymore. This is all the time, 24/7 and I think people come to us in a way that they didn’t in earlier days.” The show saw a ratings uptick as the coronavirus forced lockdowns and social distancing. Teta said that the show has been the number one daytime show in households since the start of the pandemic, and number two in households for the entire season. “We provide valuable information, and many viewers will say they get some of their news from our show, so that is a high compliment,” McLoughlin said. Teta said that the show also has benefited from being live in daytime, and guests like Winston Wolkoff and Cohen “are examples of shows that our audience is going to want to see happen as they happen.” Sara Haines ABC Teta said that they are working on ideas for shows on Election Day and the day afterward. “In 2016 we did a primetime special on Lifetime, which is a couple of hours long at the table,” Teta said. “And it was an interesting night, because obviously that was not a night that went the way most people thought it was going to.” It also was a bit of a shocker for the hosts. “We were happy that Joy made it to the end of that show,” McLoughlin quipped. “She was moderating. She had a totally different expectation, a celebration planned, which never happened.” The hosts will continue to socially distance at the start of the season. Haines will be in the studio next week, but there is no word yet on when the other hosts will return. “We’re just kind of following what is happening,” Teta said. “Right now we are going to start in a very similar way to how it ended, but it is working for us. The hosts are really getting good at doing it this way, and then we’d love to come back when it is safe.”"
nypost.com,8/30/2020,Why Joe Biden is losing ground in key swing states,https://nypost.com/2020/08/30/why-joe-biden-is-losing-ground-in-key-swing-states/,"Explore More Trump blames Biden for allowing ‘animal’ Haitian migrant accused of  bludgeoning Florida mother to death into US Dad of young SF woman shot dead by ex-Biden staffer blows lid on toxic relationship behind closed doors Former top Biden aide urges Va. Gov. Abigail Spanberger to stop using his playbook: ‘Come out of her Biden bunker’ It remains something of a mystery why there is so little apprehension among liberal pundits and leading Democrats about the similarities between battleground-state polling for the 2020 presidential election and the 2016 contest pitting President Trump against Hillary Clinton — which as you might recall did not turn out as expected. Consider the case of Wisconsin. The RealClearPolitics average had Clinton up 6.5 points in Wisconsin on Election Day in 2016. In August of that year, she had been hovering at an 11.5-point advantage. Not a single poll featured on RCP during the entire campaign showed then-candidate Donald Trump winning the state. Yet when the chips were down in November, Trump had won the Badger State by fewer than 20,000 votes, edging out Clinton with a 0.7 percentage-point average. Now turn to 2020. As I write, Democratic Party nominee Joe Biden is up by 3.5 points in the RealClearPolitics average — which is to say, the ex-veep is underperforming Clinton in the middle of a pandemic and the economic collapse caused by the lockdowns. This is the case in several battleground states. What happens if the coronavirus continues to ebb or the economy continues rebounding over the next couple of months? A new CNBC poll, for instance, finds that as serious concerns about the coronavirus fell in six 2020 battleground states, approval of Trump’s handling of the pandemic rose. This average, incidentally, was taken before the riots in Kenosha, Wis. As Wisconsin radio host Dan O’Donnell points out to me, many Republicans in the state believe the August 2016 riots in Milwaukee over the shooting death of Sylville Smith — an incident that was eventually ruled to be justified — likely played a role in Trump’s win. It was around the time the polls began to tighten in 2016. “Milwaukee is seen outstate as being wholly unlike the rest of the largely rural population because of its crime and Democrat policies,” O’Donnell says. “If people in, say, Appleton and Oshkosh (the other big swing area) and the heavily red suburbs think Milwaukee-style rioting could come to their cities next, Democrats are in big trouble here.” A new Marquette Law School Poll in Wisconsin found that support for Black Lives Matter was dropping even before the riots broke out. In June, approval of protests was widespread, with 61 percent approving and 36 percent disapproving. By August, however, 48 percent were approving and 48 percent disapproving. It is possible those numbers will take a bigger hit after Kenosha . Other swing states find Biden similarly underperforming. He is up 5.5 points in Pennsylvania. Hillary Clinton was up 9.2 the same day in 2016. Polls would tighten, but Clinton still ended up two points on Election Day. Biden was up seven points in Michigan last week, and Clinton was up nine points on the same day in 2016. Yet by the weekend, Biden’s RCP average lead had shrunk to just over 2.5 percent. Even in traditionally Democratic Minnesota, polls show some tightening, with some showing the two candidates tied and others with Biden enjoying the barest advantage (of around three points). Florida is the only battleground state where Biden (up by 3.7 points in the average spread) is outperforming Clinton (up by 2.7 points around this time). The Florida polls would also tighten in 2016. Now, if Trump loses Florida, none of the other swing states are going to matter anyway. That said, Democrat Andrew Gillum was up 3.6 points over Republican Ron DeSantis in the governor’s race, and Bill Nelson was up 2.6 points over Rick Scott in the Senate race on Election Day in 2018. Both Democrats were above 50 percent in at least three of the last five polls conducted in the state, and both lost their elections. That’s a trend. I’m no prognosticator. I was convinced Trump would be beaten soundly in 2016. Maybe pollsters have fixed the shortcomings that led to so many of us being blindsided by the outcome four years ago. Or maybe Biden’s lead will prove more durable than Clinton’s did. No election is the same. What I don’t understand, however, is why so many people seem so utterly convinced that this time will be different."
nypost.com,9/4/2020,"Joe Biden says Russia, not China, is top threat to election",https://nypost.com/2020/09/04/joe-biden-says-russia-not-china-is-top-threat-to-election/,"Explore More Trump blames Biden for allowing ‘animal’ Haitian migrant accused of  bludgeoning Florida mother to death into US Dad of young SF woman shot dead by ex-Biden staffer blows lid on toxic relationship behind closed doors Former top Biden aide urges Va. Gov. Abigail Spanberger to stop using his playbook: ‘Come out of her Biden bunker’ Democratic presidential candidate Joe Biden on Friday said that top US officials are wrong about China being the biggest threat to US elections. Biden, speaking to reporters in Wilmington, Del., rejected assertions by Attorney General William Barr, as well as Secretary of State Mike Pompeo and the FBI , that China is more responsible for meddling in internal US affairs than Russia. “No, it’s not consistent with the briefings I’ve received,” Biden said. “He’s a lousy enough attorney general, but he’s a really bad intelligence officer.” Biden, who has received intelligence briefings since July, said he believes the Cabinet secretaries are wrong “because I believe what I’ve been told.” “There are a lot of countries around the world I think would be happy to see our elections destabilized. But the one who’s working the hardest most consistently and never has let up is Russia,” Biden said. The Democrat added a taunt for Trump: “What is he so afraid of Vladimir Putin of? I mean, what, what, what’s the problem? I mean, nothing, nothing, it’s almost obsequious.” Moments after Biden’s press conference, White House National Security Advisor Robert O’Brien said at a press briefing that he agrees with Barr and Pompeo that China is the top election threat. “The Chinese have taken the most active role,” O’Brien said. “First you have China, which has the most massive program to influence the United States politically. You have Iran, and you have Russia. These are all three adversary countries that are seeking to disrupt our elections. Some of them prefer Biden, some people say some of them prefer the president.” Barr said this week in an interview that the risk of election interference comes from “China more than Russia right now.” “I’ve seen the intelligence. That’s what I’ve concluded,” Barr told CNN . “Influence basically is two kinds of things. It’s hack and dump. You get into someone’s mail system and then try to disclose embarrassing documents. It wouldn’t surprise me if they try something like that, or any other country tries that. The other way is social media and putting things out on social media.” Pompeo said in a Fox News interview that “the single greatest to the United States of America from a foreign power emanates from the Chinese Communist Party, it’s not, frankly, a close call.” See Also US counterintelligence chief: China and Iran favor Biden, Russia favors Trump The top diplomat said: “The Chinese Communist Party is building out its military, it has infiltrated the United States in ways that Russia has not, and its economic might has been used through state-owned enterprises and subsidizing companies to destroy tens of thousands of jobs all across the heartland of America, and it’s unacceptable behavior.” The Trump administration’s top counterintelligence official, National Counterintelligence and Security Center Director William Evanina, said in August that China appears to favor Biden, and that Russia — which allegedly hacked Democratic emails in 2016 — seems to favor another Trump term. “We assess that China prefers that President Trump – whom Beijing sees as unpredictable – does not win reelection,” Evanina said. “China has been expanding its influence efforts ahead of November 2020 to shape the policy environment in the United States, pressure political figures it views as opposed to China’s interests, and deflect and counter criticism of China,” he said. “[China’s] public rhetoric over the past few months has grown increasingly critical of the current Administration’s COVID-19 response [and] closure of China’s Houston Consulate.” China “harshly criticized the Administration’s statements and actions on Hong Kong, TikTok, the legal status of the South China Sea, and China’s efforts to dominate the 5G market [and] recognizes that all of these efforts might affect the [election],” Evanina said."
nypost.com,9/6/2020,Joe Biden is in a bind due to COVID-19,https://nypost.com/2020/09/06/joe-biden-is-in-a-bind-due-to-covid-19/,"Explore More Trump blames Biden for allowing ‘animal’ Haitian migrant accused of  bludgeoning Florida mother to death into US Dad of young SF woman shot dead by ex-Biden staffer blows lid on toxic relationship behind closed doors Former top Biden aide urges Va. Gov. Abigail Spanberger to stop using his playbook: ‘Come out of her Biden bunker’ Democratic presidential nominee Joe Biden and his handlers have known that he should have been out and about, weighing in daily on the issues of the campaign. In impromptu interviews, Biden should be offering alternative plans for dealing with the virus, the lockdown, the economic recovery, the violence and the looting and racial tensions. Yet until Biden’s recent press outing and visit to Kenosha , Wis., his handlers seem to have assumed that if he were to leave his basement and fully enter the fray, he could be capable of losing the election in moments of gaffes, lapses or prolonged silences. So wisely, Team Biden relied on the fact that the commander-in-chief is always blamed for bad news — and there has been plenty of bad news worldwide this year. That reality was reflected in the spring and early-summer polls that showed growing discontent with the incumbent, President Trump, as if he were solely responsible for one of the most depressing years in US history. But news cycles, like polls, are not always static. What was true in July is not necessarily so in September and especially in November. Volatile years produce volatile voters. Now, many voters think they see a waning of the virus, a need to get their kids back in school , and a glimmer of hope that the economy is recovering. A large segment of the public is becoming irate at the nightly looting, destruction and arson that no longer seem to have much to do with the May death of George Floyd while in police custody. Where are the police, the mayors and the governors to protect the vulnerable, the law-abiding and the small-business owners? Biden knows the mercurial polls now tell him that he must permanently re-emerge and cease being a virtual candidate. Yet he knows that if he does, he risks losing the race. So his surrogates talk of mandatory fact-checking of the debates — or even canceling them entirely. Former Secretary of State Hillary Clinton recently said that Biden “should not concede under any circumstances,” apparently even if he loses the November election. If the rules no longer favor Biden, then it seems time to change the rules. So Biden has become a tragic prisoner of his own paradoxes. He is an old centrist who forged a Faustian bargain with socialist Bernie Sanders and his hardcore leftist supporters. That alliance was felt necessary to win the Democratic nomination and the general election. The hard left provided the urban fireworks this summer that seemed to drive down Trump’s poll numbers. Blue-state governors and mayors contextualized the violence as a “summer of love” or “largely peaceful.” Until late last week, Biden stayed mum — both because the polls suggested he should remain so, and because he could hardly criticize those whose often violent acts were creating a sense of national anarchy under Trump’s presidency and thus undeniably aiding the Biden candidacy. But as CNN news anchor Don Lemon recently warned his fellow leftists, now the polls are changing. Lemon apparently fears that the public is sick of seeing the urban unrest. Suddenly, many members of the media want Biden to condemn the rioting and violence. But if Biden did, he might alienate his now-critical left-wing Bernie base. Yet Biden’s continued reluctance to unequivocally fault the rioters and arsonists may be alienating moderate suburban swing voters. The same paradox surrounds the debates. Should Biden, as promised, debate Trump? Yes. But would he thereby blow up his candidacy in a moment of incoherence? No. But would he end up ridiculed in absentia, like Clint Eastwood’s empty chair at the 2012 Republican convention? Trump never sits still. So should Biden match the president’s frenzied pace and hold town halls, impromptu interviews, tarmac rallies, photo ops on the campaign trail and daily unscripted press conferences? But to do so could confirm to voters that he is frail and confused. We saw some evidence of that danger in his Aug. 31 address in Pittsburgh after Biden finally emerged from his basement. He seemed confused about the COVID-19 death tally and could not quite follow his own teleprompter: “Look, the lives, when you think about it, more lives this year than any other year for the past 100 years,” Biden said. See Also Joe Biden finally reveals he's been tested for coronavirus Few knew what he meant. And when Biden also claimed that he never opposed fracking, his opponents came out almost immediately with past clips of him being critical of fracking and favoring the phasing out of fossil fuels. How did Biden become a prisoner of his own paradoxes? Perhaps he knew that he was not physically or cognitively up to running a real campaign. But he ran all the same. Perhaps he knew that the violence of Antifa and other agitators could eventually hurt more than help him, but for months he kept silent about the violence all the same, given the perceived political damage to Trump. Perhaps he knew that he had always opposed the wacky agenda of Sanders, but Biden wrongly felt he could pose as a moderate in 2020 yet if elected, keep a promise to the socialists of the more radical wing of his party to govern as a leftist. Perhaps he knows that his new progressive allies would be happy for him to win them a presidency but even happier for him to then disappear as soon as possible. Paradoxes happen when what seems real is not — and is known not to be real by those who act as if it is."
